{
  "$schema": "https://json-schema.org/draft/2020-12/schema",
  "type": "array",
  "minItems": 1,
  "items": {
    "type": "object",
    "required": ["id", "titulo", "area", "etiquetas", "contenido"],
    "additionalProperties": false,
    "properties": {
      "id": { "type": "string", "pattern": "^DOC-[0-9]{3}$" },
      "titulo": { "type": "string", "minLength": 1 },
      "area": { "type": "string", "minLength": 1 },
      "etiquetas": {
        "type": "array",
        "minItems": 1,
        "items": { "type": "string", "minLength": 1 }
      },
      "contenido": { "type": "string", "minLength": 1 }
    }
  }
}
